{
  "schemaVersion": "1.0",
  "commandId": "cmd_fixture_001",
  "commandType": "REFRESH_CASE",
  "payload": { "reason": "fixture-review" },
  "targetUserId": null,
  "targetCaseId": "case_fixture_general_001",
  "status": "CLAIMED",
  "idempotencyKey": "fixture-command-001",
  "claimedBy": "fixture-worker-a",
  "leaseExpiresAt": "2026-08-10T20:30:00+08:00",
  "attemptCount": 1,
  "retryAt": null,
  "result": null,
  "errorCode": null,
  "createdAt": "2026-08-10T20:00:00+08:00",
  "updatedAt": "2026-08-10T20:05:00+08:00"
}
